sku,brand,model,watch_name,dial_color,case_material,bezel,bracelet_strap,strap_material,gender,est_size_mm,num_photos,status,folder
RM-019,Richard Mille,RM 11-03,McLaren Flyback Chronograph Carbon Orange Accents Black Rubber Strap,Skeleton,Carbon TPT And Titanium,Carbon,Strap,Rubber,Men,50,1,need_photos,NeedMorePhotos/Richard Mille/RM 11-03/McLaren Flyback Chronograph Carbon Orange Accents Black Rubber Strap
RM-024,Richard Mille,RM 27-04,Tourbillon Red Carbon Black Skeleton Dial Black Fabric Strap,Skeleton,Carbon TPT,Red Carbon,Strap,Fabric,Men,47,1,need_photos,NeedMorePhotos/Richard Mille/RM 27-04/Tourbillon Red Carbon Black Skeleton Dial Black Fabric Strap
RM-025,Richard Mille,RM 27-04,Tourbillon Yellow Carbon Black Skeleton Dial Yellow Fabric Strap,Skeleton,Carbon TPT,Yellow Carbon,Strap,Fabric,Men,47,1,need_photos,NeedMorePhotos/Richard Mille/RM 27-04/Tourbillon Yellow Carbon Black Skeleton Dial Yellow Fabric Strap
RM-026,Richard Mille,RM 35-01,RM 35-01 Rafael Nadal Black Carbon Case Red Rubber Strap,Skeleton,Carbon TPT,Fixed Tonneau,Strap,Rubber,Men,50,1,need_photos,NeedMorePhotos/Richard Mille/RM 35-01/RM 35-01 Rafael Nadal Black Carbon Case Red Rubber Strap
RM-033,Richard Mille,RM 35-02,RM 35-02 Skeleton Black Carbon Case Black Rubber Strap,Skeleton,Carbon,Fixed Tonneau,Strap,Rubber,Men,50,1,need_photos,NeedMorePhotos/Richard Mille/RM 35-02/RM 35-02 Skeleton Black Carbon Case Black Rubber Strap
RM-034,Richard Mille,RM 35-02,RM 35-02 Skeleton Black Carbon Case Red Rubber Strap,Skeleton,Carbon,Fixed Tonneau,Strap,Rubber,Men,50,1,need_photos,NeedMorePhotos/Richard Mille/RM 35-02/RM 35-02 Skeleton Black Carbon Case Red Rubber Strap
RM-035,Richard Mille,RM 35-02,RM 35-02 Skeleton Black Carbon Case White Rubber Strap,Skeleton,Carbon,Fixed Tonneau,Strap,Rubber,Men,50,1,need_photos,NeedMorePhotos/Richard Mille/RM 35-02/RM 35-02 Skeleton Black Carbon Case White Rubber Strap
RM-036,Richard Mille,RM 35-02,RM 35-02 Skeleton Red Carbon Case Red Rubber Strap,Skeleton,Carbon,Fixed Tonneau,Strap,Rubber,Men,50,1,need_photos,NeedMorePhotos/Richard Mille/RM 35-02/RM 35-02 Skeleton Red Carbon Case Red Rubber Strap
RM-037,Richard Mille,RM 35-02,RM 35-02 Skeleton White Quartz Case Black Rubber Strap,Skeleton,Quartz TPT,Fixed Tonneau,Strap,Rubber,Men,50,1,need_photos,NeedMorePhotos/Richard Mille/RM 35-02/RM 35-02 Skeleton White Quartz Case Black Rubber Strap
RM-042,Richard Mille,RM 35-03,White Quartz TPT Black Skeleton Dial Black Rubber Strap,Skeleton,Quartz TPT,White Quartz TPT,Strap,Rubber,Men,44,1,need_photos,NeedMorePhotos/Richard Mille/RM 35-03/White Quartz TPT Black Skeleton Dial Black Rubber Strap
RM-043,Richard Mille,RM 56-02,Sapphire Transparent Case Skeleton Dial Black Rubber Strap,Skeleton,Sapphire,Sapphire,Strap,Rubber,Men,44,1,need_photos,NeedMorePhotos/Richard Mille/RM 56-02/Sapphire Transparent Case Skeleton Dial Black Rubber Strap
RM-046,Richard Mille,RM 67-01,RM 67-01 Extra Flat Skeleton Black Ceramic Black Rubber Strap,Skeleton,Ceramic,Fixed,Strap,Rubber,Unisex,38,1,need_photos,NeedMorePhotos/Richard Mille/RM 67-01/RM 67-01 Extra Flat Skeleton Black Ceramic Black Rubber Strap
RM-047,Richard Mille,RM 67-01,RM 67-01 Extra Flat Skeleton Rose Gold Black Rubber Strap,Skeleton,Rose Gold,Fixed,Strap,Rubber,Unisex,38,1,need_photos,NeedMorePhotos/Richard Mille/RM 67-01/RM 67-01 Extra Flat Skeleton Rose Gold Black Rubber Strap
RM-049,Richard Mille,RM 67-01,RM 67-01 Extra Flat Skeleton White Quartz TPT White Rubber Strap,Skeleton,Quartz TPT,Fixed,Strap,Rubber,Unisex,38,2,need_photos,NeedMorePhotos/Richard Mille/RM 67-01/RM 67-01 Extra Flat Skeleton White Quartz TPT White Rubber Strap
RM-051,Richard Mille,RM 88,RM 88 Smiley White Ceramic Case Skeleton Art Dial Yellow Strap,Multicolor,Ceramic,Fixed Tonneau,Strap,Fabric,Unisex,48,1,need_photos,NeedMorePhotos/Richard Mille/RM 88/RM 88 Smiley White Ceramic Case Skeleton Art Dial Yellow Strap
RD-001,Roger Dubuis,Excalibur,Excalibur Skeleton Flying Tourbillon Steel Black Strap,Skeleton,Stainless Steel,Notched Steel,Strap,Leather,Men,42,2,need_photos,NeedMorePhotos/Roger Dubuis/Excalibur/Excalibur Skeleton Flying Tourbillon Steel Black Strap
ROL-270,Rolex,1908,1908 Black Dial Steel,black,steel,fluted,bracelet,steel,Men,39,1,need_photos,NeedMorePhotos/Rolex/1908/1908 Black Dial Steel
ROL-324,Rolex,1908,1908 Black Steel Jubilee,black,steel,fluted,jubilee,steel,Men,39,1,need_photos,NeedMorePhotos/Rolex/1908/1908 Black Steel Jubilee
ROL-156,Rolex,1908,1908 Blue Dial Steel Fluted Bezel Jubilee,blue,steel,fluted,jubilee,steel,Men,39,2,need_photos,NeedMorePhotos/Rolex/1908/1908 Blue Dial Steel Fluted Bezel Jubilee
ROL-679,Rolex,1908,1908 Blue Dial White Gold Leather Strap,blue,white gold,smooth,strap,leather,Men,39,1,need_photos,NeedMorePhotos/Rolex/1908/1908 Blue Dial White Gold Leather Strap
ROL-321,Rolex,1908,1908 Blue Dial Yellow Gold Jubilee,blue,yellowgold,fluted,jubilee,yellowgold,Men,39,2,need_photos,NeedMorePhotos/Rolex/1908/1908 Blue Dial Yellow Gold Jubilee
ROL-204,Rolex,1908,1908 Champagne Dial Yellow Gold Jubilee,champagne,yellowgold,fluted,jubilee,yellowgold,Men,39,1,need_photos,NeedMorePhotos/Rolex/1908/1908 Champagne Dial Yellow Gold Jubilee
ROL-226,Rolex,1908,1908 Champagne Yellow Gold Fluted Bezel,champagne,yellowgold,fluted,bracelet,yellowgold,Men,39,1,need_photos,NeedMorePhotos/Rolex/1908/1908 Champagne Yellow Gold Fluted Bezel
ROL-275,Rolex,1908,1908 Green Guilloche Dial Yellow Gold Jubilee,green,yellowgold,fluted,jubilee,yellowgold,Men,39,2,need_photos,NeedMorePhotos/Rolex/1908/1908 Green Guilloche Dial Yellow Gold Jubilee
ROL-237,Rolex,1908,1908 Green Steel Fluted Bezel,green,steel,fluted,bracelet,steel,Men,39,1,need_photos,NeedMorePhotos/Rolex/1908/1908 Green Steel Fluted Bezel
ROL-236,Rolex,1908,1908 Ice Blue Steel Fluted Bezel Side Profile,ice-blue,steel,fluted,bracelet,steel,Men,39,1,need_photos,NeedMorePhotos/Rolex/1908/1908 Ice Blue Steel Fluted Bezel Side Profile
ROL-293,Rolex,1908,1908 Movement Caseback Steel Jubilee,?,platinum,?,jubilee,steel,Men,39,1,need_photos,NeedMorePhotos/Rolex/1908/1908 Movement Caseback Steel Jubilee
ROL-149,Rolex,1908,1908 Turquoise Dial Steel Jubilee,turquoise,steel,fluted,jubilee,steel,Men,39,1,need_photos,NeedMorePhotos/Rolex/1908/1908 Turquoise Dial Steel Jubilee
ROL-294,Rolex,1908,1908 Turquoise Guilloche Dial Yellow Gold Jubilee,turquoise,yellowgold,fluted,jubilee,yellowgold,Men,39,1,need_photos,NeedMorePhotos/Rolex/1908/1908 Turquoise Guilloche Dial Yellow Gold Jubilee
ROL-157,Rolex,1908,1908 White Dial Steel Fluted Bezel Jubilee,white,steel,fluted,jubilee,steel,Men,39,2,need_photos,NeedMorePhotos/Rolex/1908/1908 White Dial Steel Fluted Bezel Jubilee
ROL-821,Rolex,1908,1908 White Dial White Gold Brown Leather,white,white gold,fluted,leather strap,leather,Men,39,2,need_photos,NeedMorePhotos/Rolex/1908/1908 White Dial White Gold Brown Leather
ROL-312,Rolex,1908,1908 White Dial Yellow Gold,white,yellowgold,fluted,settimo,yellowgold,Men,39,1,need_photos,NeedMorePhotos/Rolex/1908/1908 White Dial Yellow Gold
ROL-261,Rolex,1908,1908 White Dial Yellow Gold Leather Strap,white,yellowgold,fluted,leather strap,leather,Men,39,1,need_photos,NeedMorePhotos/Rolex/1908/1908 White Dial Yellow Gold Leather Strap
ROL-827,Rolex,1908,1908 White Gold Brown Leather,?,white gold,fluted,leather strap,leather,Men,39,1,need_photos,NeedMorePhotos/Rolex/1908/1908 White Gold Brown Leather
ROL-703,Rolex,1908,Cellini Moonphase Rose Gold Leather Strap,?,rose gold,fluted,leather strap,leather,Men,39,1,need_photos,NeedMorePhotos/Rolex/1908/Cellini Moonphase Rose Gold Leather Strap
ROL-277,Rolex,Air-King,Air-King Black Dial Steel,black,steel,smooth,?,steel,Men,40,1,need_photos,NeedMorePhotos/Rolex/Air-King/Air-King Black Dial Steel
ROL-785,Rolex,Assorted,Assorted Rolex Inventory Lot,assorted,assorted,assorted,mixed,assorted,Men,,1,need_photos,NeedMorePhotos/Rolex/Assorted/Assorted Rolex Inventory Lot
ROL-538,Rolex,Cellini,Cellini Black And Silver Dials Steel And Rose Gold Leather Strap,black,stainless steel,domed,strap,leather,Men,39,1,need_photos,NeedMorePhotos/Rolex/Cellini/Cellini Black And Silver Dials Steel And Rose Gold Leather Strap
ROL-477,Rolex,Cellini,Cellini Black Dial Rose Gold Black Leather Strap,black,rose gold,fluted rose gold,strap,leather,Men,39,1,need_photos,NeedMorePhotos/Rolex/Cellini/Cellini Black Dial Rose Gold Black Leather Strap
ROL-507,Rolex,Cellini,Cellini Black Dial White Gold Leather,black,white gold,fluted,strap,leather,Men,39,1,need_photos,NeedMorePhotos/Rolex/Cellini/Cellini Black Dial White Gold Leather
ROL-503,Rolex,Cellini,Cellini Caseback Manual Movement White Gold,?,white gold,smooth,strap,leather,Men,39,1,need_photos,NeedMorePhotos/Rolex/Cellini/Cellini Caseback Manual Movement White Gold
ROL-506,Rolex,Cellini,Cellini Green Guilloche Dial White Gold Leather,green,white gold,fluted,strap,leather,Men,39,1,need_photos,NeedMorePhotos/Rolex/Cellini/Cellini Green Guilloche Dial White Gold Leather
ROL-001,Rolex,Cellini,Cellini Moonphase White Dial Rose Gold Black Strap,White,Rose Gold,Fluted,Strap,Leather,Men,39,1,need_photos,NeedMorePhotos/Rolex/Cellini/Cellini Moonphase White Dial Rose Gold Black Strap
ROL-002,Rolex,Cellini,Cellini Moonphase White Dial Rose Gold Brown Strap,White,Rose Gold,Domed Fluted,Strap,Leather,Men,39,1,need_photos,NeedMorePhotos/Rolex/Cellini/Cellini Moonphase White Dial Rose Gold Brown Strap
ROL-401,Rolex,Cellini,Cellini Moonphase White Dial Rose Gold Leather Strap,white,rose gold,fluted,leather strap,leather,Men,39,2,need_photos,NeedMorePhotos/Rolex/Cellini/Cellini Moonphase White Dial Rose Gold Leather Strap
ROL-739,Rolex,Cellini,Cellini Rose Gold Leather Strap Caseback,?,rose gold,smooth,strap,leather,Men,39,1,need_photos,NeedMorePhotos/Rolex/Cellini/Cellini Rose Gold Leather Strap Caseback
ROL-003,Rolex,Cellini,Cellini Silver Guilloche Dial Steel Black Leather Strap,Silver,Stainless Steel,Polished Steel,Strap,Leather,Men,39,1,need_photos,NeedMorePhotos/Rolex/Cellini/Cellini Silver Guilloche Dial Steel Black Leather Strap
ROL-499,Rolex,Cosmograph Daytona,Cosmograph Daytona Bagged Lot Steel,mixed,stainless steel,mixed,bracelet,stainless steel,Men,,2,need_photos,NeedMorePhotos/Rolex/Cosmograph Daytona/Cosmograph Daytona Bagged Lot Steel
ROL-666,Rolex,Cosmograph Daytona,Cosmograph Daytona Black And Silver Dial Ceramic Bezel Rubber Strap,black,steel/yellow gold,black ceramic,strap,rubber,Men,40,1,need_photos,NeedMorePhotos/Rolex/Cosmograph Daytona/Cosmograph Daytona Black And Silver Dial Ceramic Bezel Rubber Strap
ROL-561,Rolex,Cosmograph Daytona,Cosmograph Daytona Black Artistic Dial Tachymeter Bezel Rubber Strap,multicolor,carbon,black carbon tachymeter,rubber strap,rubber,Men,40,1,need_photos,NeedMorePhotos/Rolex/Cosmograph Daytona/Cosmograph Daytona Black Artistic Dial Tachymeter Bezel Rubber Strap
ROL-004,Rolex,Cosmograph Daytona,Cosmograph Daytona Black Dial Black Bezel Steel,Black,Stainless Steel,Black Ceramic,Bracelet,Stainless Steel,Men,40,1,need_photos,NeedMorePhotos/Rolex/Cosmograph Daytona/Cosmograph Daytona Black Dial Black Bezel Steel
ROL-466,Rolex,Cosmograph Daytona,Cosmograph Daytona Black Dial Everose Gold Ceramic Bezel Oyster,black,rose gold,black ceramic,oyster,rose gold,Men,40,1,need_photos,NeedMorePhotos/Rolex/Cosmograph Daytona/Cosmograph Daytona Black Dial Everose Gold Ceramic Bezel Oyster
ROL-471,Rolex,Cosmograph Daytona,Cosmograph Daytona Black Dial Everose Gold Ceramic Bezel Oysterflex,black,rose gold,black ceramic,oysterflex,rubber,Men,40,1,need_photos,NeedMorePhotos/Rolex/Cosmograph Daytona/Cosmograph Daytona Black Dial Everose Gold Ceramic Bezel Oysterflex
ROL-340,Rolex,Cosmograph Daytona,Cosmograph Daytona Black Dial Everose Gold Ceramic Bezel Pink Subdials,black,everosegold,black-ceramic-tachymeter,rubber,rubber,Men,40,1,need_photos,NeedMorePhotos/Rolex/Cosmograph Daytona/Cosmograph Daytona Black Dial Everose Gold Ceramic Bezel Pink Subdials
ROL-775,Rolex,Cosmograph Daytona,Cosmograph Daytona Black Dial Everose Gold Rainbow Bezel,Black,Everose Gold,Rainbow Sapphire,Oysterflex,Rubber,Men,40,1,need_photos,NeedMorePhotos/Rolex/Cosmograph Daytona/Cosmograph Daytona Black Dial Everose Gold Rainbow Bezel
ROL-241,Rolex,Cosmograph Daytona,Cosmograph Daytona Black Dial Rose Gold Diamond Oysterflex,black,rosegold,tachymeter-black,strap,rubber,Men,40,2,need_photos,NeedMorePhotos/Rolex/Cosmograph Daytona/Cosmograph Daytona Black Dial Rose Gold Diamond Oysterflex
ROL-202,Rolex,Cosmograph Daytona,Cosmograph Daytona Black Dial Steel Black Ceramic Bezel Oysterflex,black,steel,black ceramic tachymeter,strap,rubber,Men,40,1,need_photos,NeedMorePhotos/Rolex/Cosmograph Daytona/Cosmograph Daytona Black Dial Steel Black Ceramic Bezel Oysterflex
ROL-521,Rolex,Cosmograph Daytona,Cosmograph Daytona Black Dial Steel Ceramic Bezel Oyster,black,stainless steel,black ceramic,oyster,stainless steel,Men,40,2,need_photos,NeedMorePhotos/Rolex/Cosmograph Daytona/Cosmograph Daytona Black Dial Steel Ceramic Bezel Oyster 4
ROL-532,Rolex,Cosmograph Daytona,Cosmograph Daytona Black Dial Two Tone Gold Bezel Oyster,black,stainless steel and yellow gold,yellow gold tachymeter,oyster,stainless steel and yellow gold,Men,40,1,need_photos,NeedMorePhotos/Rolex/Cosmograph Daytona/Cosmograph Daytona Black Dial Two Tone Gold Bezel Oyster
ROL-287,Rolex,Cosmograph Daytona,Cosmograph Daytona Black Dial White Gold Ceramic Bezel,black,whitegold,black-ceramic,?,?,Men,40,2,need_photos,NeedMorePhotos/Rolex/Cosmograph Daytona/Cosmograph Daytona Black Dial White Gold Ceramic Bezel
ROL-473,Rolex,Cosmograph Daytona,Cosmograph Daytona Black Dial Yellow Gold Ceramic Bezel Oysterflex,black,yellow gold,black ceramic,oysterflex,rubber,Men,40,1,need_photos,NeedMorePhotos/Rolex/Cosmograph Daytona/Cosmograph Daytona Black Dial Yellow Gold Ceramic Bezel Oysterflex
ROL-829,Rolex,Cosmograph Daytona,Cosmograph Daytona Black Dial Yellow Gold Ceramic Bezel Rubber Strap,black,yellow gold,black ceramic,rubber strap,rubber,Men,40,1,need_photos,NeedMorePhotos/Rolex/Cosmograph Daytona/Cosmograph Daytona Black Dial Yellow Gold Ceramic Bezel Rubber Strap 3
ROL-361,Rolex,Cosmograph Daytona,Cosmograph Daytona Black Dial Yellow Gold Steel Two-Tone,black,two-tone steel and yellow gold,gold tachymeter,bracelet,two-tone steel and yellow gold,Men,40,1,need_photos,NeedMorePhotos/Rolex/Cosmograph Daytona/Cosmograph Daytona Black Dial Yellow Gold Steel Two-Tone
ROL-121,Rolex,Cosmograph Daytona,Cosmograph Daytona Black Diamond Dial Everose Gold Bracelet,black,everosegold,metal-tachymeter,bracelet,everosegold,Men,40,2,need_photos,NeedMorePhotos/Rolex/Cosmograph Daytona/Cosmograph Daytona Black Diamond Dial Everose Gold Bracelet
ROL-128,Rolex,Cosmograph Daytona,Cosmograph Daytona Black Diamond Dial Two-Tone Steel Yellow Gold Bracelet,black,steel-yellowgold,gold-tachymeter,bracelet,steel-yellowgold,Men,40,1,need_photos,NeedMorePhotos/Rolex/Cosmograph Daytona/Cosmograph Daytona Black Diamond Dial Two-Tone Steel Yellow Gold Bracelet
ROL-307,Rolex,Cosmograph Daytona,Cosmograph Daytona Black Diamond Dial White Gold Ceramic Bezel,black,whitegold,ceramic-tachymeter,oyster,whitegold,Men,40,1,need_photos,NeedMorePhotos/Rolex/Cosmograph Daytona/Cosmograph Daytona Black Diamond Dial White Gold Ceramic Bezel
ROL-832,Rolex,Cosmograph Daytona,Cosmograph Daytona Black Diamond Dial White Gold Ceramic Bezel Rubber Strap,black,white gold,black ceramic,rubber strap,rubber,Men,40,1,need_photos,NeedMorePhotos/Rolex/Cosmograph Daytona/Cosmograph Daytona Black Diamond Dial White Gold Ceramic Bezel Rubber Strap 2
ROL-776,Rolex,Cosmograph Daytona,Cosmograph Daytona Black Diamond Dial White Gold Rainbow Bezel,Black,White Gold,Rainbow Sapphire,Oyster,White Gold,Men,40,1,need_photos,NeedMorePhotos/Rolex/Cosmograph Daytona/Cosmograph Daytona Black Diamond Dial White Gold Rainbow Bezel
ROL-130,Rolex,Cosmograph Daytona,Cosmograph Daytona Black Diamond Dial Yellow Gold Bracelet,black,yellowgold,gold-tachymeter,bracelet,yellowgold,Men,40,1,need_photos,NeedMorePhotos/Rolex/Cosmograph Daytona/Cosmograph Daytona Black Diamond Dial Yellow Gold Bracelet
ROL-467,Rolex,Cosmograph Daytona,Cosmograph Daytona Black Diamond Dial Yellow Gold Tachymeter Bezel Oyster,black,yellow gold,engraved tachymeter yellow gold,oyster,yellow gold,Men,40,1,need_photos,NeedMorePhotos/Rolex/Cosmograph Daytona/Cosmograph Daytona Black Diamond Dial Yellow Gold Tachymeter Bezel Oyster
ROL-333,Rolex,Cosmograph Daytona,Cosmograph Daytona Black MOP Diamond Dial Yellow Gold Ceramic Bezel,black-mop,yellowgold,black-ceramic-tachymeter,rubber,rubber,Men,40,1,need_photos,NeedMorePhotos/Rolex/Cosmograph Daytona/Cosmograph Daytona Black MOP Diamond Dial Yellow Gold Ceramic Bezel
ROL-296,Rolex,Cosmograph Daytona,Cosmograph Daytona Black Mother-Of-Pearl Diamond Dial White Gold Ceramic Bezel,black-mop,whitegold,ceramic-tachymeter,oyster,whitegold,Men,40,1,need_photos,NeedMorePhotos/Rolex/Cosmograph Daytona/Cosmograph Daytona Black Mother-Of-Pearl Diamond Dial White Gold Ceramic Bezel
ROL-297,Rolex,Cosmograph Daytona,Cosmograph Daytona Black Mother-Of-Pearl Diamond Dial Yellow Gold,black-mop,yellowgold,gold-tachymeter,oyster,yellowgold,Men,40,1,need_photos,NeedMorePhotos/Rolex/Cosmograph Daytona/Cosmograph Daytona Black Mother-Of-Pearl Diamond Dial Yellow Gold
ROL-767,Rolex,Cosmograph Daytona,Cosmograph Daytona Blue Dial Two Tone Gold Tachymeter Bezel Oyster,blue,steel and gold,tachymeter gold,Oyster,steel and gold,Men,40,1,need_photos,NeedMorePhotos/Rolex/Cosmograph Daytona/Cosmograph Daytona Blue Dial Two Tone Gold Tachymeter Bezel Oyster
ROL-302,Rolex,Cosmograph Daytona,Cosmograph Daytona Blue Dial White Gold,blue,whitegold,steel-tachymeter,oyster,whitegold,Men,40,1,need_photos,NeedMorePhotos/Rolex/Cosmograph Daytona/Cosmograph Daytona Blue Dial White Gold
ROL-527,Rolex,Cosmograph Daytona,Cosmograph Daytona Blue Mother Of Pearl Diamond Dial White Gold Ceramic Bezel Oyster,blue mother of pearl,white gold,black ceramic,oyster,white gold,Men,40,1,need_photos,NeedMorePhotos/Rolex/Cosmograph Daytona/Cosmograph Daytona Blue Mother Of Pearl Diamond Dial White Gold Ceramic Bezel Oyster
ROL-759,Rolex,Cosmograph Daytona,Cosmograph Daytona Carbon Fiber Various Dials,various,carbon fiber,carbon fiber tachymeter,strap,rubber,Men,40,1,need_photos,NeedMorePhotos/Rolex/Cosmograph Daytona/Cosmograph Daytona Carbon Fiber Various Dials
ROL-439,Rolex,Cosmograph Daytona,Cosmograph Daytona Champagne Dial Two-Tone Gold Tachymeter Bezel,champagne,steel and yellow gold,yellow gold tachymeter,bracelet,steel and yellow gold,Men,40,2,need_photos,NeedMorePhotos/Rolex/Cosmograph Daytona/Cosmograph Daytona Champagne Dial Two-Tone Gold Tachymeter Bezel
ROL-442,Rolex,Cosmograph Daytona,Cosmograph Daytona Champagne Dial Two-Tone Steel Yellow Gold Tachymeter Bezel Oyster Bracelet,champagne,steel and yellow gold,yellow gold tachymeter,oyster bracelet,steel and yellow gold,Men,40,1,need_photos,NeedMorePhotos/Rolex/Cosmograph Daytona/Cosmograph Daytona Champagne Dial Two-Tone Steel Yellow Gold Tachymeter Bezel Oyster Bracelet
ROL-341,Rolex,Cosmograph Daytona,Cosmograph Daytona Champagne Dial Yellow Gold Black Subdials,champagne,yellowgold,yellowgold-tachymeter,oyster,yellowgold,Men,40,1,need_photos,NeedMorePhotos/Rolex/Cosmograph Daytona/Cosmograph Daytona Champagne Dial Yellow Gold Black Subdials
ROL-129,Rolex,Cosmograph Daytona,Cosmograph Daytona Champagne Dial Yellow Gold Bracelet,champagne,yellowgold,gold-tachymeter,bracelet,yellowgold,Men,40,1,need_photos,NeedMorePhotos/Rolex/Cosmograph Daytona/Cosmograph Daytona Champagne Dial Yellow Gold Bracelet
ROL-131,Rolex,Cosmograph Daytona,Cosmograph Daytona Champagne Dial Yellow Gold Ceramic Bezel Rubber Strap,champagne,yellowgold,ceramic-tachymeter,strap,rubber,Men,40,2,need_photos,NeedMorePhotos/Rolex/Cosmograph Daytona/Cosmograph Daytona Champagne Dial Yellow Gold Ceramic Bezel Rubber Strap
ROL-359,Rolex,Cosmograph Daytona,Cosmograph Daytona Chocolate Arabic Dial Everose Gold,chocolate,everose gold,gold tachymeter,bracelet,everose gold,Men,40,1,need_photos,NeedMorePhotos/Rolex/Cosmograph Daytona/Cosmograph Daytona Chocolate Arabic Dial Everose Gold
ROL-119,Rolex,Cosmograph Daytona,Cosmograph Daytona Chocolate Brown Dial Everose Gold Bracelet,chocolate,everosegold,metal-tachymeter,bracelet,everosegold,Men,40,1,need_photos,NeedMorePhotos/Rolex/Cosmograph Daytona/Cosmograph Daytona Chocolate Brown Dial Everose Gold Bracelet
