sku,brand,model,watch_name,dial_color,case_material,bezel,bracelet_strap,strap_material,gender,est_size_mm,num_photos,status,folder
CAR-013,Cartier,Santos,Santos Steel Silver Dial Steel Bracelet,Silver,Stainless Steel,Steel Stepped,Bracelet,Stainless Steel,Men,35,1,need_photos,NeedMorePhotos/Cartier/Santos/Santos Steel Silver Dial Steel Bracelet
CAR-014,Cartier,Santos,Santos Two Tone Rose Gold Silver Dial Steel Bracelet,Silver,Steel And Yellow Gold,Two Tone Stepped,Bracelet,Stainless Steel,Men,35,1,need_photos,NeedMorePhotos/Cartier/Santos/Santos Two Tone Rose Gold Silver Dial Steel Bracelet
CAR-015,Cartier,Santos,Santos Two Tone Yellow Gold Silver Dial Steel Bracelet,Silver,Steel And Yellow Gold,Two Tone Stepped,Bracelet,Stainless Steel,Men,35,1,need_photos,NeedMorePhotos/Cartier/Santos/Santos Two Tone Yellow Gold Silver Dial Steel Bracelet
CAR-016,Cartier,Santos,Santos White Dial Rose Gold Bracelet,White,Rose Gold,Rose Gold Bezel With Screws,Bracelet,Rose Gold,Men,40,1,need_photos,NeedMorePhotos/Cartier/Santos/Santos White Dial Rose Gold Bracelet
CAR-017,Cartier,Santos,Santos White Dial Steel Bracelet,White,Stainless Steel,Steel Bezel With Screws,Bracelet,Stainless Steel,Men,40,1,need_photos,NeedMorePhotos/Cartier/Santos/Santos White Dial Steel Bracelet
CAR-018,Cartier,Santos,Santos White Dial Two Tone Steel And Gold Bracelet,White,Steel And Yellow Gold,Yellow Gold Bezel With Screws,Bracelet,Steel And Yellow Gold,Men,40,1,need_photos,NeedMorePhotos/Cartier/Santos/Santos White Dial Two Tone Steel And Gold Bracelet
CAR-019,Cartier,Santos-Dumont,Santos-Dumont Silver Dial Rose Gold Brown Leather Strap,Silver,Rose Gold,Smooth,Strap,Leather,Unisex,31,1,need_photos,NeedMorePhotos/Cartier/Santos-Dumont/Santos-Dumont Silver Dial Rose Gold Brown Leather Strap
CAR-020,Cartier,Santos-Dumont,Santos-Dumont Silver Dial Steel Black Leather Strap,Silver,Stainless Steel,Smooth,Strap,Leather,Unisex,31,1,need_photos,NeedMorePhotos/Cartier/Santos-Dumont/Santos-Dumont Silver Dial Steel Black Leather Strap
CAR-021,Cartier,Tank,Tank Francaise White Dial Steel Bracelet,White,Stainless Steel,Smooth Steel,Bracelet,Stainless Steel,Women,25,1,need_photos,NeedMorePhotos/Cartier/Tank/Tank Francaise White Dial Steel Bracelet
CAR-022,Cartier,Tank,Tank Solo Rose Gold Diamond Bezel White Dial Brown Strap,White,Rose Gold,Diamond Set,Strap,Leather,Women,30,1,need_photos,NeedMorePhotos/Cartier/Tank/Tank Solo Rose Gold Diamond Bezel White Dial Brown Strap
CAR-023,Cartier,Tank,Tank Solo Steel White Dial Black Strap,White,Stainless Steel,Smooth,Strap,Leather,Women,30,1,need_photos,NeedMorePhotos/Cartier/Tank/Tank Solo Steel White Dial Black Strap
CAR-024,Cartier,Tank,Tank Solo Steel White Dial Steel Bracelet,White,Stainless Steel,Smooth,Bracelet,Stainless Steel,Women,30,1,need_photos,NeedMorePhotos/Cartier/Tank/Tank Solo Steel White Dial Steel Bracelet
CAR-025,Cartier,Tank,Tank Solo Yellow Gold White Dial Brown Strap,White,Yellow Gold,Smooth,Strap,Leather,Women,30,1,need_photos,NeedMorePhotos/Cartier/Tank/Tank Solo Yellow Gold White Dial Brown Strap
FM-001,Franck Muller,Vanguard,Vanguard Black Dial Steel Black Strap,Black,Stainless Steel,Smooth Steel,Strap,Leather,Men,44,2,need_photos,NeedMorePhotos/Franck Muller/Vanguard/Vanguard Black Dial Steel Black Strap
HUB-001,Hublot,Big Bang,Big Bang Sang Bleu Rose Gold Blue Dial Blue Rubber Strap,Blue,Rose Gold,Faceted Rose Gold,Strap,Rubber,Men,45,1,need_photos,NeedMorePhotos/Hublot/Big Bang/Big Bang Sang Bleu Rose Gold Blue Dial Blue Rubber Strap
HUB-002,Hublot,Big Bang,Big Bang Unico Rose Gold Blue Dial Blue Rubber Strap,Blue,Rose Gold,Bolted Rose Gold,Strap,Rubber,Men,44,1,need_photos,NeedMorePhotos/Hublot/Big Bang/Big Bang Unico Rose Gold Blue Dial Blue Rubber Strap
HUB-003,Hublot,Classic Fusion,Classic Fusion Black Ceramic Carbon Dial Black Strap,Black,Ceramic,Bolted Ceramic,Strap,Leather,Men,42,1,need_photos,NeedMorePhotos/Hublot/Classic Fusion/Classic Fusion Black Ceramic Carbon Dial Black Strap
HUB-004,Hublot,Classic Fusion,Classic Fusion Black Dial Diamond Bezel Black Leather Strap,Black,Titanium,Diamond Set,Strap,Leather,Unisex,42,1,need_photos,NeedMorePhotos/Hublot/Classic Fusion/Classic Fusion Black Dial Diamond Bezel Black Leather Strap
HUB-005,Hublot,Classic Fusion,Classic Fusion Black Dial Diamond Bezel Black Rubber Strap,Black,Titanium,Diamond Set,Strap,Rubber,Unisex,38,1,need_photos,NeedMorePhotos/Hublot/Classic Fusion/Classic Fusion Black Dial Diamond Bezel Black Rubber Strap
HUB-006,Hublot,Classic Fusion,Classic Fusion Blue Dial Steel Diamond Bezel Blue Rubber Strap,Blue,Stainless Steel,Diamond-Set Steel,Strap,Rubber,Unisex,33,1,need_photos,NeedMorePhotos/Hublot/Classic Fusion/Classic Fusion Blue Dial Steel Diamond Bezel Blue Rubber Strap
HUB-007,Hublot,Classic Fusion,Classic Fusion Gray Dial Steel Diamond Bezel Gray Leather Strap,Gray,Stainless Steel,Diamond-Set Steel,Strap,Leather,Unisex,38,1,need_photos,NeedMorePhotos/Hublot/Classic Fusion/Classic Fusion Gray Dial Steel Diamond Bezel Gray Leather Strap
HUB-008,Hublot,Classic Fusion,Classic Fusion Gray Dial Steel Diamond Bezel Gray Rubber Strap,Gray,Stainless Steel,Diamond-Set Steel,Strap,Rubber,Unisex,33,1,need_photos,NeedMorePhotos/Hublot/Classic Fusion/Classic Fusion Gray Dial Steel Diamond Bezel Gray Rubber Strap
HUB-009,Hublot,Classic Fusion,Classic Fusion Green Dial Steel Diamond Bezel Green Leather Strap,Green,Stainless Steel,Diamond-Set Steel,Strap,Leather,Unisex,38,1,need_photos,NeedMorePhotos/Hublot/Classic Fusion/Classic Fusion Green Dial Steel Diamond Bezel Green Leather Strap
HUB-010,Hublot,Classic Fusion,Classic Fusion Green Dial Steel Diamond Bezel Green Rubber Strap,Green,Stainless Steel,Diamond-Set Steel,Strap,Rubber,Unisex,33,1,need_photos,NeedMorePhotos/Hublot/Classic Fusion/Classic Fusion Green Dial Steel Diamond Bezel Green Rubber Strap
HUB-011,Hublot,Spirit of Big Bang,Spirit Of Big Bang Black Dial Rose Gold Black Rubber Strap,Black,Rose Gold,Ceramic and Gold,Strap,Rubber,Men,42,1,need_photos,NeedMorePhotos/Hublot/Spirit of Big Bang/Spirit Of Big Bang Black Dial Rose Gold Black Rubber Strap
HUB-012,Hublot,Spirit of Big Bang,Spirit Of Big Bang Black Dial Titanium And Black Ceramic Rubber Strap,Black,Titanium,Ceramic,Strap,Rubber,Men,42,1,need_photos,NeedMorePhotos/Hublot/Spirit of Big Bang/Spirit Of Big Bang Black Dial Titanium And Black Ceramic Rubber Strap
HUB-013,Hublot,Spirit of Big Bang,Spirit Of Big Bang Blue Dial Rose Gold Blue Rubber Strap,Blue,Rose Gold,Ceramic and Gold,Strap,Rubber,Men,42,1,need_photos,NeedMorePhotos/Hublot/Spirit of Big Bang/Spirit Of Big Bang Blue Dial Rose Gold Blue Rubber Strap
HUB-014,Hublot,Spirit of Big Bang,Spirit Of Big Bang Chronograph Black Dial Black Rubber Strap,Black,Titanium,Smooth,Strap,Rubber,Men,42,1,need_photos,NeedMorePhotos/Hublot/Spirit of Big Bang/Spirit Of Big Bang Chronograph Black Dial Black Rubber Strap
HUB-015,Hublot,Spirit of Big Bang,Spirit Of Big Bang Chronograph Silver Dial Titanium Grey Rubber Strap,Silver,Titanium,Smooth,Strap,Rubber,Men,42,1,need_photos,NeedMorePhotos/Hublot/Spirit of Big Bang/Spirit Of Big Bang Chronograph Silver Dial Titanium Grey Rubber Strap
HUB-016,Hublot,Spirit of Big Bang,Spirit Of Big Bang Light Blue Dial Light Blue Rubber Strap,Light Blue,Titanium,Ceramic and Metal,Strap,Rubber,Men,42,1,need_photos,NeedMorePhotos/Hublot/Spirit of Big Bang/Spirit Of Big Bang Light Blue Dial Light Blue Rubber Strap
HUB-017,Hublot,Spirit of Big Bang,Spirit Of Big Bang Light Blue Dial Two Tone And Rose Gold Rubber Strap,Light Blue,Titanium And Rose Gold,Smooth,Strap,Rubber,Men,42,1,need_photos,NeedMorePhotos/Hublot/Spirit of Big Bang/Spirit Of Big Bang Light Blue Dial Two Tone And Rose Gold Rubber Strap
HUB-018,Hublot,Spirit of Big Bang,Spirit Of Big Bang Titanium Black And Blue Dial Rubber Strap,Black,Titanium,Smooth,Strap,Rubber,Men,42,1,need_photos,NeedMorePhotos/Hublot/Spirit of Big Bang/Spirit Of Big Bang Titanium Black And Blue Dial Rubber Strap
HUB-019,Hublot,Spirit of Big Bang,Spirit Of Big Bang Titanium Light Blue Dial Rubber Strap,Light Blue,Titanium,Smooth,Strap,Rubber,Men,42,1,need_photos,NeedMorePhotos/Hublot/Spirit of Big Bang/Spirit Of Big Bang Titanium Light Blue Dial Rubber Strap
IWC-001,IWC,Ingenieur,Ingenieur Automatic Black Dial Steel Bracelet,Black,Stainless Steel,Steel,Bracelet,Stainless Steel,Men,40,1,need_photos,NeedMorePhotos/IWC/Ingenieur/Ingenieur Automatic Black Dial Steel Bracelet
IWC-002,IWC,Ingenieur,Ingenieur Automatic Blue Dial Steel Bracelet,Blue,Stainless Steel,Steel,Bracelet,Stainless Steel,Men,40,2,need_photos,NeedMorePhotos/IWC/Ingenieur/Ingenieur Automatic Blue Dial Steel Bracelet
IWC-003,IWC,Ingenieur,Ingenieur Automatic Rose Gold Black Dial Bracelet,Black,Rose Gold,Rose Gold,Bracelet,Rose Gold,Men,40,1,need_photos,NeedMorePhotos/IWC/Ingenieur/Ingenieur Automatic Rose Gold Black Dial Bracelet
IWC-004,IWC,Ingenieur,Ingenieur Automatic Rose Gold Salmon Dial Bracelet,Salmon,Rose Gold,Rose Gold,Bracelet,Rose Gold,Men,40,1,need_photos,NeedMorePhotos/IWC/Ingenieur/Ingenieur Automatic Rose Gold Salmon Dial Bracelet
IWC-005,IWC,Ingenieur,Ingenieur Automatic Silver Dial Steel Bracelet,Silver,Stainless Steel,Steel,Bracelet,Stainless Steel,Men,40,1,need_photos,NeedMorePhotos/IWC/Ingenieur/Ingenieur Automatic Silver Dial Steel Bracelet
JLC-001,Jaeger-LeCoultre,Master Control,Master Control Black Dial Steel Blue Leather Strap,Black,Stainless Steel,Smooth Steel,Strap,Leather,Men,40,2,need_photos,NeedMorePhotos/Jaeger-LeCoultre/Master Control/Master Control Black Dial Steel Blue Leather Strap
JLC-002,Jaeger-LeCoultre,Master Control,Master Control Caseback Steel Blue Leather Strap,,Stainless Steel,Smooth Steel,Strap,Leather,Men,40,1,need_photos,NeedMorePhotos/Jaeger-LeCoultre/Master Control/Master Control Caseback Steel Blue Leather Strap
JLC-003,Jaeger-LeCoultre,Master Control,Master Control Geographic Blue Dial Steel Blue Leather Strap,Blue,Stainless Steel,Smooth Steel,Strap,Leather,Men,39,2,need_photos,NeedMorePhotos/Jaeger-LeCoultre/Master Control/Master Control Geographic Blue Dial Steel Blue Leather Strap
JLC-004,Jaeger-LeCoultre,Master Geographic,Master Geographic Blue Dial Steel Blue Leather Strap,Blue,Stainless Steel,Smooth Steel,Strap,Leather,Men,39,2,need_photos,NeedMorePhotos/Jaeger-LeCoultre/Master Geographic/Master Geographic Blue Dial Steel Blue Leather Strap
JLC-005,Jaeger-LeCoultre,Master Geographic,Master Geographic Blue Dial Steel Power Reserve Blue Strap,Blue,Stainless Steel,Smooth,Strap,Leather,Men,39,1,need_photos,NeedMorePhotos/Jaeger-LeCoultre/Master Geographic/Master Geographic Blue Dial Steel Power Reserve Blue Strap
JLC-006,Jaeger-LeCoultre,Master Ultra Thin Moon,Master Ultra Thin Moon Black Dial Steel Gray Strap,Black,Stainless Steel,Smooth,Strap,Leather,Men,39,1,need_photos,NeedMorePhotos/Jaeger-LeCoultre/Master Ultra Thin Moon/Master Ultra Thin Moon Black Dial Steel Gray Strap
JLC-007,Jaeger-LeCoultre,Master Ultra Thin Moon,Master Ultra Thin Moon Blue Dial Rose Gold Blue Strap,Blue,Rose Gold,Smooth,Strap,Leather,Men,39,1,need_photos,NeedMorePhotos/Jaeger-LeCoultre/Master Ultra Thin Moon/Master Ultra Thin Moon Blue Dial Rose Gold Blue Strap
JLC-008,Jaeger-LeCoultre,Master Ultra Thin Moon,Master Ultra Thin Moon Gray Dial Steel Gray Strap,Gray,Stainless Steel,Smooth,Strap,Leather,Men,39,1,need_photos,NeedMorePhotos/Jaeger-LeCoultre/Master Ultra Thin Moon/Master Ultra Thin Moon Gray Dial Steel Gray Strap
JLC-009,Jaeger-LeCoultre,Master Ultra Thin Moon,Master Ultra Thin Moon Steel Blue Dial Gray Leather Strap,Blue,Stainless Steel,Smooth,Strap,Leather,Men,39,1,need_photos,NeedMorePhotos/Jaeger-LeCoultre/Master Ultra Thin Moon/Master Ultra Thin Moon Steel Blue Dial Gray Leather Strap
JLC-010,Jaeger-LeCoultre,Master Ultra Thin Moon,Master Ultra Thin Moon Steel Blue Guilloche Dial Gray Leather Strap,Blue,Stainless Steel,Smooth,Strap,Leather,Men,39,1,need_photos,NeedMorePhotos/Jaeger-LeCoultre/Master Ultra Thin Moon/Master Ultra Thin Moon Steel Blue Guilloche Dial Gray Leather Strap
JLC-011,Jaeger-LeCoultre,Master Ultra Thin Moon,Master Ultra Thin Moon Steel Silver Dial Gray Leather Strap,Silver,Stainless Steel,Smooth,Strap,Leather,Men,39,2,need_photos,NeedMorePhotos/Jaeger-LeCoultre/Master Ultra Thin Moon/Master Ultra Thin Moon Steel Silver Dial Gray Leather Strap
OMG-001,Omega,Constellation,Constellation Purple Diamond Dial Steel Roman Bezel Bracelet,Purple,Stainless Steel,Steel Roman Numeral,Bracelet,Stainless Steel,Women,28,1,need_photos,NeedMorePhotos/Omega/Constellation/Constellation Purple Diamond Dial Steel Roman Bezel Bracelet
OMG-002,Omega,Seamaster Aqua Terra,Aqua Terra Blue Dial Steel Bracelet,Blue,Stainless Steel,Stainless Steel,Bracelet,Stainless Steel,Men,41,1,need_photos,NeedMorePhotos/Omega/Seamaster Aqua Terra/Aqua Terra Blue Dial Steel Bracelet
OMG-003,Omega,Seamaster Aqua Terra,Aqua Terra Silver Dial Steel Bracelet,Silver,Stainless Steel,Stainless Steel,Bracelet,Stainless Steel,Men,41,1,need_photos,NeedMorePhotos/Omega/Seamaster Aqua Terra/Aqua Terra Silver Dial Steel Bracelet
OMG-004,Omega,Seamaster Aqua Terra,Aqua Terra Turquoise Dial Steel Bracelet,Turquoise,Stainless Steel,Stainless Steel,Bracelet,Stainless Steel,Men,38,2,need_photos,NeedMorePhotos/Omega/Seamaster Aqua Terra/Aqua Terra Turquoise Dial Steel Bracelet
OMG-005,Omega,Seamaster Aqua Terra,Aqua Terra Worldtimer Blue Dial Blue Rubber Strap,Blue,Stainless Steel,Stainless Steel,Strap,Rubber,Men,43,2,need_photos,NeedMorePhotos/Omega/Seamaster Aqua Terra/Aqua Terra Worldtimer Blue Dial Blue Rubber Strap
OMG-006,Omega,Seamaster Aqua Terra,Aqua Terra Worldtimer Blue Dial Steel Bracelet,Blue,Stainless Steel,Stainless Steel,Bracelet,Stainless Steel,Men,43,1,need_photos,NeedMorePhotos/Omega/Seamaster Aqua Terra/Aqua Terra Worldtimer Blue Dial Steel Bracelet
OMG-007,Omega,Seamaster Aqua Terra,Aqua Terra Worldtimer Grey Dial Titanium Black Rubber Strap,Grey,Titanium,Black Ceramic,Strap,Rubber,Men,43,1,need_photos,NeedMorePhotos/Omega/Seamaster Aqua Terra/Aqua Terra Worldtimer Grey Dial Titanium Black Rubber Strap
OMG-008,Omega,Seamaster Aqua Terra,Seamaster Aqua Terra Black Dial Green Accents Stainless Steel,Black,Stainless Steel,Polished Steel,Bracelet,Stainless Steel,Men,41,1,need_photos,NeedMorePhotos/Omega/Seamaster Aqua Terra/Seamaster Aqua Terra Black Dial Green Accents Stainless Steel
OMG-009,Omega,Seamaster Aqua Terra,Seamaster Aqua Terra Black Dial Stainless Steel,Black,Stainless Steel,Polished Steel,Bracelet,Stainless Steel,Men,41,1,need_photos,NeedMorePhotos/Omega/Seamaster Aqua Terra/Seamaster Aqua Terra Black Dial Stainless Steel
OMG-010,Omega,Seamaster Aqua Terra,Seamaster Aqua Terra Black Dial Steel Bracelet,Black,Stainless Steel,Smooth Steel,Bracelet,Stainless Steel,Men,41,1,need_photos,NeedMorePhotos/Omega/Seamaster Aqua Terra/Seamaster Aqua Terra Black Dial Steel Bracelet
OMG-011,Omega,Seamaster Aqua Terra,Seamaster Aqua Terra Blue Teak Dial Steel Bracelet,Blue,Stainless Steel,Steel,Bracelet,Stainless Steel,Men,41,1,need_photos,NeedMorePhotos/Omega/Seamaster Aqua Terra/Seamaster Aqua Terra Blue Teak Dial Steel Bracelet
OMG-012,Omega,Seamaster Aqua Terra,Seamaster Aqua Terra Grey Teak Dial Steel Bracelet,Grey,Stainless Steel,Steel,Bracelet,Stainless Steel,Men,41,1,need_photos,NeedMorePhotos/Omega/Seamaster Aqua Terra/Seamaster Aqua Terra Grey Teak Dial Steel Bracelet
OMG-014,Omega,Seamaster Aqua Terra,Seamaster Aqua Terra Turquoise Dial Steel Bracelet,Turquoise,Stainless Steel,Smooth Steel,Bracelet,Stainless Steel,Men,41,2,need_photos,NeedMorePhotos/Omega/Seamaster Aqua Terra/Seamaster Aqua Terra Turquoise Dial Steel Bracelet
OMG-017,Omega,Seamaster Diver 300M,Seamaster Diver 300M Black Dial Two Tone Sedna Gold Black Ceramic Bezel Rubber Strap,Black,Steel and Rose Gold,Black Ceramic Diver Bezel With Rose Gold Ring,Strap,Rubber,Men,42,1,need_photos,NeedMorePhotos/Omega/Seamaster Diver 300M/Seamaster Diver 300M Black Dial Two Tone Sedna Gold Black Ceramic Bezel Rubber Strap
OMG-018,Omega,Seamaster Diver 300M,Seamaster Diver Black Wave Dial Steel Black Ceramic Bezel Black Rubber Strap,Black,Stainless Steel,Black Ceramic,Strap,Rubber,Men,42,1,need_photos,NeedMorePhotos/Omega/Seamaster Diver 300M/Seamaster Diver Black Wave Dial Steel Black Ceramic Bezel Black Rubber Strap
OMG-019,Omega,Speedmaster,Speedmaster Moonphase Blue Dial Black Bezel Stainless Steel,Blue,Stainless Steel,Black Tachymeter,Bracelet,Stainless Steel,Men,44,1,need_photos,NeedMorePhotos/Omega/Speedmaster/Speedmaster Moonphase Blue Dial Black Bezel Stainless Steel
OMG-020,Omega,Speedmaster,Speedmaster Moonwatch Black Dial Black Bezel Stainless Steel,Black,Stainless Steel,Black Tachymeter,Bracelet,Stainless Steel,Men,42,1,need_photos,NeedMorePhotos/Omega/Speedmaster/Speedmaster Moonwatch Black Dial Black Bezel Stainless Steel
OMG-021,Omega,Speedmaster,Speedmaster Professional Black Dial Steel,Black,Stainless Steel,Black Tachymeter,Bracelet,Stainless Steel,Men,42,1,need_photos,NeedMorePhotos/Omega/Speedmaster/Speedmaster Professional Black Dial Steel
OMG-023,Omega,Speedmaster,Speedmaster Racing Blue Dial Black Bezel Stainless Steel,Blue,Stainless Steel,Black Tachymeter,Bracelet,Stainless Steel,Men,44,1,need_photos,NeedMorePhotos/Omega/Speedmaster/Speedmaster Racing Blue Dial Black Bezel Stainless Steel
PP-001,Patek Philippe,Aquanaut,Aquanaut Black Embossed Dial Steel Black Rubber Strap,Black,Stainless Steel,Steel,Strap,Rubber,Men,40,1,need_photos,NeedMorePhotos/Patek Philippe/Aquanaut/Aquanaut Black Embossed Dial Steel Black Rubber Strap
PP-003,Patek Philippe,Calatrava,Calatrava Pilot Black Dial Steel Carbon Strap,Black,Stainless Steel,Smooth,Strap,Carbon,Men,40,2,need_photos,NeedMorePhotos/Patek Philippe/Calatrava/Calatrava Pilot Black Dial Steel Carbon Strap
PP-004,Patek Philippe,Complications,Travel Time Annual Calendar Silver Dial Rose Gold Brown Strap,Silver,Rose Gold,Smooth,Strap,Leather,Men,42,1,need_photos,NeedMorePhotos/Patek Philippe/Complications/Travel Time Annual Calendar Silver Dial Rose Gold Brown Strap
PP-005,Patek Philippe,Cubitus,Cubitus Blue Dial White Gold Blue Fabric Strap,Blue,White Gold,Octagonal,Strap,Fabric,Men,45,1,need_photos,NeedMorePhotos/Patek Philippe/Cubitus/Cubitus Blue Dial White Gold Blue Fabric Strap
PP-006,Patek Philippe,Cubitus,Cubitus Green Dial Steel Bracelet,Green,Stainless Steel,Steel Octagonal,Bracelet,Stainless Steel,Men,45,1,need_photos,NeedMorePhotos/Patek Philippe/Cubitus/Cubitus Green Dial Steel Bracelet
PP-007,Patek Philippe,Cubitus,Cubitus Perpetual Calendar Blue Dial Blue Strap,Blue,Stainless Steel,Steel Octagonal,Strap,Fabric,Men,45,1,need_photos,NeedMorePhotos/Patek Philippe/Cubitus/Cubitus Perpetual Calendar Blue Dial Blue Strap
PP-008,Patek Philippe,Grand Complications,Perpetual Calendar Moonphase Cream Dial White Gold Brown Leather Strap,Cream,White Gold,Smooth White Gold,Strap,Leather,Men,40,1,need_photos,NeedMorePhotos/Patek Philippe/Grand Complications/Perpetual Calendar Moonphase Cream Dial White Gold Brown Leather Strap
PP-009,Patek Philippe,Nautilus,Nautilus Blue Dial Steel,Blue,Stainless Steel,Steel,Bracelet,Stainless Steel,Women,35,1,need_photos,NeedMorePhotos/Patek Philippe/Nautilus/Nautilus Blue Dial Steel
PP-010,Patek Philippe,Nautilus,Nautilus Blue Dial Steel Moon Phase Power Reserve,Blue,Stainless Steel,Smooth Steel,Bracelet,Stainless Steel,Men,40,1,need_photos,NeedMorePhotos/Patek Philippe/Nautilus/Nautilus Blue Dial Steel Moon Phase Power Reserve
PP-011,Patek Philippe,Nautilus,Nautilus Brown Dial Diamond Bezel Steel,Brown,Stainless Steel,Diamond,Bracelet,Stainless Steel,Women,35,1,need_photos,NeedMorePhotos/Patek Philippe/Nautilus/Nautilus Brown Dial Diamond Bezel Steel
PP-012,Patek Philippe,Nautilus,Nautilus Brown Grey Dial Rose Gold Diamond Bezel,Brown,Rose Gold,Diamond Set,Bracelet,Rose Gold,Men,40,1,need_photos,NeedMorePhotos/Patek Philippe/Nautilus/Nautilus Brown Grey Dial Rose Gold Diamond Bezel
PP-014,Patek Philippe,Nautilus,Nautilus Diamond Bezel Blue Dial Black Strap,Blue,White Gold,Diamond Set,Strap,Leather,Men,40,1,need_photos,NeedMorePhotos/Patek Philippe/Nautilus/Nautilus Diamond Bezel Blue Dial Black Strap
PP-015,Patek Philippe,Nautilus,Nautilus Grey Dial Steel Smooth Bezel,Grey,Stainless Steel,Smooth Steel,Bracelet,Stainless Steel,Women,35,1,need_photos,NeedMorePhotos/Patek Philippe/Nautilus/Nautilus Grey Dial Steel Smooth Bezel
PP-016,Patek Philippe,Nautilus,Nautilus Ladies Rose Gold Golden Dial Diamond Bezel,Rose Gold,Rose Gold,Diamond Set,Bracelet,Rose Gold,Women,35,1,need_photos,NeedMorePhotos/Patek Philippe/Nautilus/Nautilus Ladies Rose Gold Golden Dial Diamond Bezel
PP-017,Patek Philippe,Nautilus,Nautilus Ladies Rose Gold White Dial Diamond Bezel,White,Rose Gold,Diamond Set,Bracelet,Rose Gold,Women,32,2,need_photos,NeedMorePhotos/Patek Philippe/Nautilus/Nautilus Ladies Rose Gold White Dial Diamond Bezel
PP-018,Patek Philippe,Nautilus,Nautilus Perpetual Calendar Purple Dial Steel Bracelet,Purple,Stainless Steel,Smooth,Bracelet,Stainless Steel,Men,40,1,need_photos,NeedMorePhotos/Patek Philippe/Nautilus/Nautilus Perpetual Calendar Purple Dial Steel Bracelet
PP-019,Patek Philippe,Nautilus,Nautilus Rose Gold Diamond Bezel Brown Dial Brown Strap,Brown,Rose Gold,Diamond Set,Strap,Leather,Men,40,1,need_photos,NeedMorePhotos/Patek Philippe/Nautilus/Nautilus Rose Gold Diamond Bezel Brown Dial Brown Strap
PP-020,Patek Philippe,Nautilus,Nautilus White Dial Steel Diamond Bezel,White,Stainless Steel,Diamond Set,Bracelet,Stainless Steel,Women,35,1,need_photos,NeedMorePhotos/Patek Philippe/Nautilus/Nautilus White Dial Steel Diamond Bezel
PP-021,Patek Philippe,Nautilus,Nautilus White Dial Steel Smooth Bezel,White,Stainless Steel,Smooth Steel,Bracelet,Stainless Steel,Women,35,1,need_photos,NeedMorePhotos/Patek Philippe/Nautilus/Nautilus White Dial Steel Smooth Bezel
PP-022,Patek Philippe,World Time,World Time Black And Silver Dial White Gold Bracelet,Black,White Gold,Smooth,Bracelet,White Gold,Men,40,1,need_photos,NeedMorePhotos/Patek Philippe/World Time/World Time Black And Silver Dial White Gold Bracelet
PIA-001,Piaget,Polo,Polo Blue Dial Steel Blue Leather Strap,Blue,Stainless Steel,Steel,Strap,Leather,Men,42,1,need_photos,NeedMorePhotos/Piaget/Polo/Polo Blue Dial Steel Blue Leather Strap
RM-001,Richard Mille,RM 035,RM 035 Americas Rose Gold Skeleton Black Rubber Strap,Skeleton,Rose Gold,Fixed,Strap,Rubber,Unisex,38,1,need_photos,NeedMorePhotos/Richard Mille/RM 035/RM 035 Americas Rose Gold Skeleton Black Rubber Strap
RM-003,Richard Mille,RM 035,RM 035 Black Carbon Case Skeleton Dial White Rubber Strap,Skeleton,Carbon,Tonneau,Strap,Rubber,Men,48,1,need_photos,NeedMorePhotos/Richard Mille/RM 035/RM 035 Black Carbon Case Skeleton Dial White Rubber Strap
RM-004,Richard Mille,RM 035,RM 035 Skeleton Black Ceramic Case Black Rubber Strap,Skeleton,Ceramic,Fixed Tonneau,Strap,Rubber,Men,48,1,need_photos,NeedMorePhotos/Richard Mille/RM 035/RM 035 Skeleton Black Ceramic Case Black Rubber Strap
RM-005,Richard Mille,RM 035,RM 035 Transparent Sapphire Case Black Inner Bezel White Rubber Strap,Skeleton,Sapphire Crystal,Transparent Sapphire,Strap,Rubber,Men,44,1,need_photos,NeedMorePhotos/Richard Mille/RM 035/RM 035 Transparent Sapphire Case Black Inner Bezel White Rubber Strap
RM-006,Richard Mille,RM 035,RM 035 Transparent Sapphire Case Blue Inner Bezel White Rubber Strap,Skeleton,Sapphire Crystal,Transparent Sapphire,Strap,Rubber,Men,44,1,need_photos,NeedMorePhotos/Richard Mille/RM 035/RM 035 Transparent Sapphire Case Blue Inner Bezel White Rubber Strap
RM-007,Richard Mille,RM 035,RM 035 Transparent Sapphire Case Rose Gold Inner Bezel White Rubber Strap,Skeleton,Sapphire Crystal,Transparent Sapphire,Strap,Rubber,Men,44,1,need_photos,NeedMorePhotos/Richard Mille/RM 035/RM 035 Transparent Sapphire Case Rose Gold Inner Bezel White Rubber Strap
RM-008,Richard Mille,RM 035,RM 035 Transparent Sapphire Case White Inner Bezel White Rubber Strap,Skeleton,Sapphire Crystal,Transparent Sapphire,Strap,Rubber,Men,44,1,need_photos,NeedMorePhotos/Richard Mille/RM 035/RM 035 Transparent Sapphire Case White Inner Bezel White Rubber Strap
RM-009,Richard Mille,RM 055,RM 055 Black Case Diamond Bezel Skeleton Dial Black Rubber Strap,Skeleton,Carbon,Diamond Set,Strap,Rubber,Men,44,1,need_photos,NeedMorePhotos/Richard Mille/RM 055/RM 055 Black Case Diamond Bezel Skeleton Dial Black Rubber Strap
RM-012,Richard Mille,RM 055,RM 055 Green Case Skeleton Dial Orange Rubber Strap,Skeleton,Carbon,Tonneau,Strap,Rubber,Men,48,1,need_photos,NeedMorePhotos/Richard Mille/RM 055/RM 055 Green Case Skeleton Dial Orange Rubber Strap
RM-013,Richard Mille,RM 055,RM 055 Skeleton Black Ceramic Case Black Rubber Strap,Skeleton,Ceramic,Fixed Tonneau,Strap,Rubber,Men,48,1,need_photos,NeedMorePhotos/Richard Mille/RM 055/RM 055 Skeleton Black Ceramic Case Black Rubber Strap
RM-014,Richard Mille,RM 055,RM 055 Skeleton Black Ceramic Case Rose Gold Movement Black Rubber Strap,Skeleton,Ceramic,Fixed Tonneau,Strap,Rubber,Men,48,2,need_photos,NeedMorePhotos/Richard Mille/RM 055/RM 055 Skeleton Black Ceramic Case Rose Gold Movement Black Rubber Strap
RM-016,Richard Mille,RM 055,RM 055 White Case Skeleton Dial White Rubber Strap,Skeleton,Ceramic,Tonneau,Strap,Rubber,Men,48,1,need_photos,NeedMorePhotos/Richard Mille/RM 055/RM 055 White Case Skeleton Dial White Rubber Strap
RM-017,Richard Mille,RM 055,RM 055 White Ceramic Case Skeleton Dial White Rubber Strap,Skeleton,Ceramic,Tonneau,Strap,Rubber,Men,48,1,need_photos,NeedMorePhotos/Richard Mille/RM 055/RM 055 White Ceramic Case Skeleton Dial White Rubber Strap
RM-018,Richard Mille,RM 11-03,Flyback Chronograph Carbon Rose Gold Skeleton Dial Black Rubber Strap,Skeleton,Carbon TPT And Rose Gold,Carbon,Strap,Rubber,Men,50,1,need_photos,NeedMorePhotos/Richard Mille/RM 11-03/Flyback Chronograph Carbon Rose Gold Skeleton Dial Black Rubber Strap
