sku,brand,model,watch_name,dial_color,case_material,bezel,bracelet_strap,strap_material,gender,est_size_mm,num_photos,status,folder
ROL-907,Rolex,GMT-Master II,GMT-Master II Steel Green Black Bezel Jubilee,?,steel,green black,bracelet,steel,Men,40,5,web_ready,Rolex/GMT-Master II/GMT-Master II Steel Green Black Bezel Jubilee
ROL-460,Rolex,GMT-Master II,GMT-Master II Steel Oyster,?,steel,?,Oyster,steel,Men,40,4,web_ready,Rolex/GMT-Master II/GMT-Master II Steel Oyster
ROL-847,Rolex,GMT-Master II,Gmt-Master II Black Dial Everose Gold Gem-Set Bezel Diamond Case President Bracelet,Black,Everose Gold,Gem-Set Ruby Sapphire Diamond,President,Everose Gold,Men,40,5,web_ready,Rolex/GMT-Master II/Gmt-Master II Black Dial Everose Gold Gem-Set Bezel Diamond Case President Bracelet
ROL-791,Rolex,GMT-Master II,Gmt-Master II Diw Cream Dial Forged Carbon Yellow Gold Bezel Green Strap,Cream,Forged Carbon,Forged Carbon Yellow Gold,Strap,Green Fabric,Men,40,5,web_ready,Rolex/GMT-Master II/Gmt-Master II Diw Cream Dial Forged Carbon Yellow Gold Bezel Green Strap
ROL-554,Rolex,GMT-Master II,Gmt-Master II Root Beer Black Dial Two-Tone Steel And Everose Gold Brown And Black Bezel,black,steel and everose gold,brown and black ceramic,oyster,steel and everose gold,Men,40,9,web_ready,Rolex/GMT-Master II/Gmt-Master II Root Beer Black Dial Two-Tone Steel And Everose Gold Brown And Black Bezel
ROL-584,Rolex,GMT-Master II,Gmt-Master II Rose Gold Diamond Gem-Set Bezel Oyster,black,rose gold,gem-set sapphire ruby,oyster,rose gold,Men,40,6,web_ready,Rolex/GMT-Master II/Gmt-Master II Rose Gold Diamond Gem-Set Bezel Oyster
ROL-544,Rolex,GMT-Master II,Gmt-Master II Sprite Black Dial Steel Green Black Bezel Jubilee Bracelet,Black,Stainless Steel,Green Black Ceramic,Jubilee,Stainless Steel,Men,40,50,web_ready,Rolex/GMT-Master II/Gmt-Master II Sprite Black Dial Steel Green Black Bezel Jubilee Bracelet
ROL-391,Rolex,Land-Dweller,Land-Dweller Ice Blue Dial Steel Fluted Bezel Jubilee,Ice Blue,Stainless Steel,Fluted,Jubilee,Stainless Steel,Men,36,15,web_ready,Rolex/Land-Dweller/Land-Dweller Ice Blue Dial Steel Fluted Bezel Jubilee
ROL-392,Rolex,Land-Dweller,Land-Dweller Silver Dial Steel Fluted Bezel Jubilee,Silver,Stainless Steel,Fluted,Jubilee,Stainless Steel,Men,36,3,web_ready,Rolex/Land-Dweller/Land-Dweller Silver Dial Steel Fluted Bezel Jubilee
ROL-539,Rolex,Land-Dweller,Land-Dweller Silver Honeycomb Dial Steel Fluted Bezel Jubilee,silver,stainless steel,fluted,bracelet,stainless steel,Men,40,10,web_ready,Rolex/Land-Dweller/Land-Dweller Silver Honeycomb Dial Steel Fluted Bezel Jubilee
ROL-730,Rolex,Land-Dweller,Land-Dweller Steel Fluted Bezel Jubilee,?,stainless steel,fluted white gold,bracelet,stainless steel,Unisex,36,4,web_ready,Rolex/Land-Dweller/Land-Dweller Steel Fluted Bezel Jubilee
ROL-458,Rolex,Milgauss,Milgauss Green Dial Stainless Steel Smooth Bezel Oyster,green,stainless steel,smooth steel,bracelet,stainless steel,Men,40,5,web_ready,Rolex/Milgauss/Milgauss Green Dial Stainless Steel Smooth Bezel Oyster
ROL-332,Rolex,Milgauss,Milgauss Green Dial Steel Smooth Bezel Oyster,green,steel,smooth steel,oyster,steel,Men,40,5,web_ready,Rolex/Milgauss/Milgauss Green Dial Steel Smooth Bezel Oyster
ROL-796,Rolex,Milgauss,Milgauss Z-Blue Dial Steel Smooth Bezel Oyster,blue,stainless steel,smooth,bracelet,stainless steel,Men,40,8,web_ready,Rolex/Milgauss/Milgauss Z-Blue Dial Steel Smooth Bezel Oyster
ROL-212,Rolex,Milgauss,Milgauss Z-Blue Steel Green Sapphire Smooth Bezel Oyster,blue,steel,smooth,oyster,steel,Men,40,7,web_ready,Rolex/Milgauss/Milgauss Z-Blue Steel Green Sapphire Smooth Bezel Oyster
ROL-260,Rolex,Milgauss,Milgauss Z-Blue Steel Green Sapphire Smooth Bezel Oyster,?,steel,smooth,oyster,steel,Men,40,8,web_ready,Rolex/Milgauss/Milgauss Z-Blue Steel Green Sapphire Smooth Bezel Oyster 2
ROL-772,Rolex,Oyster Perpetual,Oyster Perpetual Blue Dial Steel Smooth Bezel Oyster,Blue,Stainless Steel,Smooth,Oyster,Stainless Steel,Men,41,6,web_ready,Rolex/Oyster Perpetual/Oyster Perpetual Blue Dial Steel Smooth Bezel Oyster
ROL-247,Rolex,Oyster Perpetual,Oyster Perpetual Green Dial Steel Oyster,green,steel,smooth,oyster,steel,Unisex,36,4,web_ready,Rolex/Oyster Perpetual/Oyster Perpetual Green Dial Steel Oyster
ROL-402,Rolex,Oyster Perpetual,Oyster Perpetual Pink Dial Steel Smooth Bezel,pink,steel,smooth,oyster,steel,Unisex,36,6,web_ready,Rolex/Oyster Perpetual/Oyster Perpetual Pink Dial Steel Smooth Bezel
ROL-380,Rolex,Oyster Perpetual,Oyster Perpetual Steel Smooth Bezel Oyster Variants Poster,?,steel,smooth,oyster,steel,Unisex,41,4,web_ready,Rolex/Oyster Perpetual/Oyster Perpetual Steel Smooth Bezel Oyster Variants Poster
ROL-443,Rolex,Oyster Perpetual,Oyster Perpetual Turquoise Blue Steel Oyster,turquoise blue,steel,smooth,oyster,steel,Men,41,10,web_ready,Rolex/Oyster Perpetual/Oyster Perpetual Turquoise Blue Steel Oyster
ROL-710,Rolex,Oyster Perpetual,Oyster Perpetual Turquoise Dial Steel Smooth Bezel Jubilee,turquoise,steel,smooth,bracelet,steel,Unisex,41,20,web_ready,Rolex/Oyster Perpetual/Oyster Perpetual Turquoise Dial Steel Smooth Bezel Jubilee
ROL-396,Rolex,Oyster Perpetual,Oyster Perpetual Turquoise Dial Steel Smooth Bezel Oyster,turquoise,stainless steel,smooth,oyster,stainless steel,Unisex,41,6,web_ready,Rolex/Oyster Perpetual/Oyster Perpetual Turquoise Dial Steel Smooth Bezel Oyster
ROL-245,Rolex,Oyster Perpetual,Oyster Perpetual Yellow Dial Steel Oyster,yellow,steel,smooth,oyster,steel,Unisex,36,3,web_ready,Rolex/Oyster Perpetual/Oyster Perpetual Yellow Dial Steel Oyster
ROL-732,Rolex,Sea-Dweller,Sea-Dweller Black Dial Steel Black Ceramic Bezel Oyster,black,stainless steel,black ceramic,oyster,stainless steel,Men,43,7,web_ready,Rolex/Sea-Dweller/Sea-Dweller Black Dial Steel Black Ceramic Bezel Oyster
ROL-135,Rolex,Sea-Dweller,Sea-Dweller Deepsea D-Blue Dial Steel,?,steel,?,bracelet,steel,Men,44,7,web_ready,Rolex/Sea-Dweller/Sea-Dweller Deepsea D-Blue Dial Steel 2
ROL-566,Rolex,Sky-Dweller,Sky-Dweller Black Dial Steel White Gold Fluted Bezel,black,steel,white gold fluted,bracelet,steel,Men,42,7,web_ready,Rolex/Sky-Dweller/Sky-Dweller Black Dial Steel White Gold Fluted Bezel
ROL-637,Rolex,Sky-Dweller,Sky-Dweller Black Dial Steel White Gold Fluted Bezel Jubilee,black,stainless steel,fluted,bracelet,stainless steel,Men,42,5,web_ready,Rolex/Sky-Dweller/Sky-Dweller Black Dial Steel White Gold Fluted Bezel Jubilee
ROL-462,Rolex,Sky-Dweller,Sky-Dweller Black Dial Yellow Gold Fluted Bezel Oysterflex,black,yellow gold,fluted,oysterflex,rubber,Men,42,8,web_ready,Rolex/Sky-Dweller/Sky-Dweller Black Dial Yellow Gold Fluted Bezel Oysterflex
ROL-868,Rolex,Sky-Dweller,Sky-Dweller Blue Dial Steel White Gold Fluted Bezel Jubilee,blue,stainless steel,white gold fluted,bracelet,stainless steel,Men,42,6,web_ready,Rolex/Sky-Dweller/Sky-Dweller Blue Dial Steel White Gold Fluted Bezel Jubilee
ROL-904,Rolex,Sky-Dweller,Sky-Dweller Blue Dial White Gold Fluted Bezel Jubilee,blue,steel,white gold fluted,jubilee,steel,Men,42,5,web_ready,Rolex/Sky-Dweller/Sky-Dweller Blue Dial White Gold Fluted Bezel Jubilee
ROL-636,Rolex,Sky-Dweller,Sky-Dweller Champagne Dial Two-Tone Fluted Bezel Jubilee,champagne,steel and yellow gold,fluted,bracelet,steel and yellow gold,Men,42,9,web_ready,Rolex/Sky-Dweller/Sky-Dweller Champagne Dial Two-Tone Fluted Bezel Jubilee
ROL-464,Rolex,Sky-Dweller,Sky-Dweller Champagne Dial Yellow Gold Fluted Bezel Oysterflex,champagne,yellow gold,fluted,oysterflex,rubber,Men,42,5,web_ready,Rolex/Sky-Dweller/Sky-Dweller Champagne Dial Yellow Gold Fluted Bezel Oysterflex
ROL-635,Rolex,Sky-Dweller,Sky-Dweller Champagne Dial Yellow Gold Fluted Bezel Oysterflex,champagne,yellow gold,fluted,strap,rubber,Men,42,4,web_ready,Rolex/Sky-Dweller/Sky-Dweller Champagne Dial Yellow Gold Fluted Bezel Oysterflex 2
ROL-716,Rolex,Sky-Dweller,Sky-Dweller Chocolate Dial Rose Gold Fluted Bezel Oysterflex,brown,rose gold,fluted,Oysterflex,rubber,Men,42,6,web_ready,Rolex/Sky-Dweller/Sky-Dweller Chocolate Dial Rose Gold Fluted Bezel Oysterflex
ROL-461,Rolex,Sky-Dweller,Sky-Dweller Everose Gold Fluted Bezel Oysterflex,?,everose gold,fluted,oysterflex,rubber,Men,42,6,web_ready,Rolex/Sky-Dweller/Sky-Dweller Everose Gold Fluted Bezel Oysterflex
ROL-709,Rolex,Sky-Dweller,Sky-Dweller Silver Dial Steel Fluted Bezel Jubilee,silver,steel,fluted white gold,bracelet,steel,Men,42,3,web_ready,Rolex/Sky-Dweller/Sky-Dweller Silver Dial Steel Fluted Bezel Jubilee
ROL-905,Rolex,Sky-Dweller,Sky-Dweller Steel Fluted Bezel Jubilee Caseback,?,steel,white gold fluted,jubilee,steel,Men,42,4,web_ready,Rolex/Sky-Dweller/Sky-Dweller Steel Fluted Bezel Jubilee Caseback
ROL-869,Rolex,Sky-Dweller,Sky-Dweller Steel White Gold Fluted Bezel Jubilee,?,stainless steel,white gold fluted,bracelet,stainless steel,Men,42,5,web_ready,Rolex/Sky-Dweller/Sky-Dweller Steel White Gold Fluted Bezel Jubilee
ROL-870,Rolex,Sky-Dweller,Sky-Dweller White Dial Steel White Gold Fluted Bezel Jubilee,white,stainless steel,white gold fluted,bracelet,stainless steel,Men,42,6,web_ready,Rolex/Sky-Dweller/Sky-Dweller White Dial Steel White Gold Fluted Bezel Jubilee
ROL-186,Rolex,Submariner,Submariner Black Dial Steel Ceramic Bezel,black,steel,black-ceramic,?,?,Men,41,3,web_ready,Rolex/Submariner/Submariner Black Dial Steel Ceramic Bezel
ROL-194,Rolex,Submariner,Submariner Black Dial Steel Diamond Set Black Baguette Bezel,black,steel,black baguette diamond,oyster,steel,Men,40,41,web_ready,Rolex/Submariner/Submariner Black Dial Steel Diamond Set Black Baguette Bezel
ROL-457,Rolex,Submariner,Submariner Black Dial Two-Tone Steel And Gold Oyster,black,steel and yellow gold,black gold-trim,bracelet,steel and yellow gold,Men,40,11,web_ready,Rolex/Submariner/Submariner Black Dial Two-Tone Steel And Gold Oyster
ROL-192,Rolex,Submariner,Submariner Black Dial Yellow Gold Black Ceramic Bezel Oyster,black,yellowgold,ceramic-black,oyster,yellowgold,Men,41,4,web_ready,Rolex/Submariner/Submariner Black Dial Yellow Gold Black Ceramic Bezel Oyster
ROL-534,Rolex,Submariner,Submariner Blue Dial Diamond-Set Steel Blue Gem Bezel,blue,stainless steel,blue gem-set,Oyster,diamond-set steel,Men,40,3,web_ready,Rolex/Submariner/Submariner Blue Dial Diamond-Set Steel Blue Gem Bezel
ROL-193,Rolex,Submariner,Submariner Blue Dial Yellow Gold Blue Ceramic Bezel Oyster,blue,yellowgold,ceramic-blue,oyster,yellowgold,Men,41,15,web_ready,Rolex/Submariner/Submariner Blue Dial Yellow Gold Blue Ceramic Bezel Oyster
ROL-576,Rolex,Submariner,Submariner Date Black Dial Steel And Yellow Gold Black Ceramic Bezel Oyster,black,steel and yellow gold,black ceramic,oyster,steel and yellow gold,Men,40,18,web_ready,Rolex/Submariner/Submariner Date Black Dial Steel And Yellow Gold Black Ceramic Bezel Oyster
ROL-418,Rolex,Submariner,Submariner Date Black Dial Steel Black Ceramic Bezel Oyster Bracelet,black,stainless steel,black ceramic,bracelet,stainless steel,Men,41,53,web_ready,Rolex/Submariner/Submariner Date Black Dial Steel Black Ceramic Bezel Oyster Bracelet
ROL-535,Rolex,Submariner,Submariner Date Black Dial Steel Green Ceramic Bezel Oyster,Black,Stainless Steel,Green Ceramic,Oyster,Stainless Steel,Men,41,43,web_ready,Rolex/Submariner/Submariner Date Black Dial Steel Green Ceramic Bezel Oyster
ROL-545,Rolex,Submariner,Submariner Date Black Dial White Gold Blue Ceramic Bezel Oyster,black,white gold,blue ceramic,Oyster,white gold,Men,41,8,web_ready,Rolex/Submariner/Submariner Date Black Dial White Gold Blue Ceramic Bezel Oyster
ROL-311,Rolex,Submariner,Submariner Date Black Dial Yellow Gold Black Bezel Oyster,black,yellowgold,black-ceramic,bracelet,yellowgold,Men,41,5,web_ready,Rolex/Submariner/Submariner Date Black Dial Yellow Gold Black Bezel Oyster
ROL-094,Rolex,Submariner,Submariner Date Black Steel And Yellow Gold Ceramic Bezel,black,steel-yellowgold,ceramic-black,oyster,steel-yellowgold,Men,41,15,web_ready,Rolex/Submariner/Submariner Date Black Steel And Yellow Gold Ceramic Bezel
ROL-577,Rolex,Submariner,Submariner Date Blue Dial Steel and Yellow Gold Blue Bezel Oyster,blue,steel and yellow gold,blue ceramic,Oyster,steel and yellow gold,Men,40,8,web_ready,Rolex/Submariner/Submariner Date Blue Dial Steel and Yellow Gold Blue Bezel Oyster
ROL-078,Rolex,Submariner,Submariner Date Blue Dial Two-Tone Steel Yellow Gold Blue Ceramic Bezel Oyster,blue,steel-yellowgold,ceramic-blue,oyster,steel-yellowgold,Men,41,27,web_ready,Rolex/Submariner/Submariner Date Blue Dial Two-Tone Steel Yellow Gold Blue Ceramic Bezel Oyster
ROL-513,Rolex,Submariner,Submariner Date Hulk Green Dial Steel Green Ceramic Bezel Oyster Bracelet,green,stainless steel,green ceramic,bracelet,stainless steel,Men,40,4,web_ready,Rolex/Submariner/Submariner Date Hulk Green Dial Steel Green Ceramic Bezel Oyster Bracelet
ROL-517,Rolex,Submariner,Submariner Date Steel Black Ceramic Bezel Oyster Bracelet,?,stainless steel,black ceramic,bracelet,stainless steel,Men,41,7,web_ready,Rolex/Submariner/Submariner Date Steel Black Ceramic Bezel Oyster Bracelet
ROL-185,Rolex,Submariner,Submariner Date Steel Caliber 3235 Movement,?,steel,?,bracelet,steel,Men,41,11,web_ready,Rolex/Submariner/Submariner Date Steel Caliber 3235 Movement
ROL-536,Rolex,Submariner,Submariner Diamond-Set Steel Oyster Clasp,?,stainless steel,?,Oyster,diamond-set steel,Men,40,6,web_ready,Rolex/Submariner/Submariner Diamond-Set Steel Oyster Clasp
ROL-533,Rolex,Submariner,Submariner Green Dial Diamond-Set Steel Green Gem Bezel,green,stainless steel,green gem-set,Oyster,diamond-set steel,Men,40,8,web_ready,Rolex/Submariner/Submariner Green Dial Diamond-Set Steel Green Gem Bezel
ROL-515,Rolex,Submariner,Submariner Green Dial Steel Diamond Bezel Green Rubber Strap,green,stainless steel,diamond,strap,rubber,Men,40,8,web_ready,Rolex/Submariner/Submariner Green Dial Steel Diamond Bezel Green Rubber Strap
ROL-219,Rolex,Submariner,Submariner Green Dial Steel Diamond Set Green Baguette Bezel,green,steel,green baguette,oyster,steel,Men,40,11,web_ready,Rolex/Submariner/Submariner Green Dial Steel Diamond Set Green Baguette Bezel
ROL-654,Rolex,Submariner,Submariner Green Dial Yellow Gold Green Baguette Bezel Diamond Set Bracelet,Green,Yellow Gold,Green Baguette Gem Set,Diamond Set Oyster Bracelet,Yellow Gold,Men,40,3,web_ready,Rolex/Submariner/Submariner Green Dial Yellow Gold Green Baguette Bezel Diamond Set Bracelet
ROL-419,Rolex,Submariner,Submariner Multicolor Phantomlab Transparent Custom,multicolor,sapphire,clear,strap,rubber,Men,40,9,web_ready,Rolex/Submariner/Submariner Multicolor Phantomlab Transparent Custom
ROL-184,Rolex,Submariner,Submariner No-Date Black Dial Steel Ceramic Bezel Oyster,black,steel,black ceramic,bracelet,steel,Men,40,21,web_ready,Rolex/Submariner/Submariner No-Date Black Dial Steel Ceramic Bezel Oyster
ROL-718,Rolex,Submariner,Submariner Skeleton Black Dlc Carbon Bezel,Skeleton,DLC Steel,Black Carbon,Bracelet,DLC Steel,Men,40,9,web_ready,Rolex/Submariner/Submariner Skeleton Black Dlc Carbon Bezel
ROL-874,Rolex,Submariner,Submariner Skeleton Dial Steel Forged Carbon Bezel,Skeleton,Steel,Forged Carbon,Bracelet,Steel,Men,40,18,web_ready,Rolex/Submariner/Submariner Skeleton Dial Steel Forged Carbon Bezel
ROL-786,Rolex,Submariner,Submariner Skeleton Steel Green Bezel,skeleton,steel,green,rubber,rubber,Men,40,9,web_ready,Rolex/Submariner/Submariner Skeleton Steel Green Bezel
ROL-719,Rolex,Submariner,Submariner Skeleton Yellow Gold Carbon Bezel,Skeleton,Yellow Gold,Carbon,Bracelet,Yellow Gold,Men,40,9,web_ready,Rolex/Submariner/Submariner Skeleton Yellow Gold Carbon Bezel
ROL-205,Rolex,Submariner,Submariner Steel Ceramic Bezel Oyster Variants Poster,?,steel,ceramic,oyster,steel,Men,40,11,web_ready,Rolex/Submariner/Submariner Steel Ceramic Bezel Oyster Variants Poster
ROL-795,Rolex,Submariner,Submariner Two-Tone Steel And Yellow Gold Oyster,?,steel and yellow gold,?,bracelet,steel and yellow gold,Men,40,4,web_ready,Rolex/Submariner/Submariner Two-Tone Steel And Yellow Gold Oyster
ROL-474,Rolex,Yacht-Master,Yacht-Master 42 Black Dial White Gold Black Ceramic Bezel Oysterflex,Black,White Gold,Black Ceramic,Strap,Rubber,Men,42,10,web_ready,Rolex/Yacht-Master/Yacht-Master 42 Black Dial White Gold Black Ceramic Bezel Oysterflex
ROL-314,Rolex,Yacht-Master,Yacht-Master Black Dial Everose Gold Ceramic Bezel Oysterflex,black,everose-gold,ceramic-bidirectional,oysterflex,rubber,Men,40,19,web_ready,Rolex/Yacht-Master/Yacht-Master Black Dial Everose Gold Ceramic Bezel Oysterflex
ROL-884,Rolex,Yacht-Master,Yacht-Master Black Dial Steel Black Ceramic Bezel Oyster,black,stainless steel,black ceramic,oyster,stainless steel,Men,40,11,web_ready,Rolex/Yacht-Master/Yacht-Master Black Dial Steel Black Ceramic Bezel Oyster
ROL-445,Rolex,Yacht-Master,Yacht-Master Black Dial Steel Ceramic Bezel Rubber Strap,Black,Steel,Ceramic,Oysterflex,Rubber,Men,42,10,web_ready,Rolex/Yacht-Master/Yacht-Master Black Dial Steel Ceramic Bezel Rubber Strap
ROL-390,Rolex,Yacht-Master,Yacht-Master Black Dial Steel Platinum Bezel Oyster,black,steel,platinum,oyster,steel,Men,40,9,web_ready,Rolex/Yacht-Master/Yacht-Master Black Dial Steel Platinum Bezel Oyster
ROL-415,Rolex,Yacht-Master,Yacht-Master Black Dial Steel Platinum Bezel Oysterflex,black,stainless steel,platinum,strap,rubber,Men,42,10,web_ready,Rolex/Yacht-Master/Yacht-Master Black Dial Steel Platinum Bezel Oysterflex
ROL-151,Rolex,Yacht-Master,Yacht-Master Black Dial Titanium Black Ceramic Bezel Oyster,black,titanium,black-ceramic,oyster,titanium,Men,42,16,web_ready,Rolex/Yacht-Master/Yacht-Master Black Dial Titanium Black Ceramic Bezel Oyster
ROL-715,Rolex,Yacht-Master,Yacht-Master Black Dial White Gold Ceramic Bezel Oysterflex,black,white gold,black ceramic,Oysterflex,rubber,Men,42,5,web_ready,Rolex/Yacht-Master/Yacht-Master Black Dial White Gold Ceramic Bezel Oysterflex
ROL-677,Rolex,Yacht-Master,Yacht-Master Black Dial Yellow Gold Black Bezel Oysterflex,black,yellow gold,black ceramic,oysterflex strap,rubber,Men,42,9,web_ready,Rolex/Yacht-Master/Yacht-Master Black Dial Yellow Gold Black Bezel Oysterflex 2
ROL-529,Rolex,Yacht-Master,Yacht-Master Blue Dial Steel Platinum Bezel Oyster,blue,stainless steel,platinum,oyster,stainless steel,Men,40,5,web_ready,Rolex/Yacht-Master/Yacht-Master Blue Dial Steel Platinum Bezel Oyster
ROL-691,Rolex,Yacht-Master,Yacht-Master Blue Dial Steel Platinum Bezel Oyster,blue,steel,platinum,oyster,steel,Men,40,9,web_ready,Rolex/Yacht-Master/Yacht-Master Blue Dial Steel Platinum Bezel Oyster 2
ROL-315,Rolex,Yacht-Master,Yacht-Master Everose Gold Black Bezel Oysterflex,?,everose gold,black ceramic,oysterflex,rubber,Men,40,3,web_ready,Rolex/Yacht-Master/Yacht-Master Everose Gold Black Bezel Oysterflex
ROL-818,Rolex,Yacht-Master,Yacht-Master Meteorite Dial Sapphire Crystal Case White Rubber Strap,white meteorite,sapphire crystal,sapphire crystal,strap,rubber,Men,40,3,web_ready,Rolex/Yacht-Master/Yacht-Master Meteorite Dial Sapphire Crystal Case White Rubber Strap
ROL-281,Rolex,Yacht-Master,Yacht-Master Rhodium Dial Rolesium Platinum Bezel,rhodium,steel-platinum,platinum,oyster,steel,Men,40,6,web_ready,Rolex/Yacht-Master/Yacht-Master Rhodium Dial Rolesium Platinum Bezel
ROL-652,Rolex,Yacht-Master,Yacht-Master Rhodium Dial Steel Platinum Bezel Oyster,rhodium,stainless steel,platinum,oyster,stainless steel,Men,40,3,web_ready,Rolex/Yacht-Master/Yacht-Master Rhodium Dial Steel Platinum Bezel Oyster
ROL-564,Rolex,Yacht-Master,Yacht-Master Slate Dial Everose Gold Black Ceramic Bezel,slate,everose gold,black ceramic,rubber strap,rubber,Men,40,7,web_ready,Rolex/Yacht-Master/Yacht-Master Slate Dial Everose Gold Black Ceramic Bezel
ROL-873,Rolex,Yacht-Master,Yacht-Master Slate Dial Steel Platinum Bezel Oyster,slate,stainless steel,platinum,oyster,stainless steel,Men,40,9,web_ready,Rolex/Yacht-Master/Yacht-Master Slate Dial Steel Platinum Bezel Oyster
ROL-283,Rolex,Yacht-Master,Yacht-Master Steel Platinum Bezel Oyster Variants Poster,?,steel,platinum,oyster,steel,Men,40,4,web_ready,Rolex/Yacht-Master/Yacht-Master Steel Platinum Bezel Oyster Variants Poster
ROL-342,Rolex,Yacht-Master,Yacht-Master White Gold Oysterflex,?,white-gold,?,strap,rubber,Men,42,3,web_ready,Rolex/Yacht-Master/Yacht-Master White Gold Oysterflex
AP-001,Audemars Piguet,Code 11.59,Code 11.59 Blue Dial Rose Gold Blue Leather Strap,Blue,Rose Gold,Black Ceramic,Strap,Leather,Men,41,1,need_photos,NeedMorePhotos/Audemars Piguet/Code 11.59/Code 11.59 Blue Dial Rose Gold Blue Leather Strap
AP-002,Audemars Piguet,Royal Oak,Royal Oak Black Dial Steel Bracelet,Black,Stainless Steel,Octagonal,Bracelet,Stainless Steel,Men,41,1,need_photos,NeedMorePhotos/Audemars Piguet/Royal Oak/Royal Oak Black Dial Steel Bracelet
AP-003,Audemars Piguet,Royal Oak,Royal Oak Blue Dial Steel Bracelet,Blue,Stainless Steel,Octagonal,Bracelet,Stainless Steel,Men,41,1,need_photos,NeedMorePhotos/Audemars Piguet/Royal Oak/Royal Oak Blue Dial Steel Bracelet
AP-004,Audemars Piguet,Royal Oak,Royal Oak Blue Dial Steel Diamond Bezel,Blue,Stainless Steel,Diamond Set,Bracelet,Stainless Steel,Women,33,1,need_photos,NeedMorePhotos/Audemars Piguet/Royal Oak/Royal Oak Blue Dial Steel Diamond Bezel
AP-005,Audemars Piguet,Royal Oak,Royal Oak Blue Dial Steel Smooth Bezel,Blue,Stainless Steel,Steel,Bracelet,Stainless Steel,Men,41,1,need_photos,NeedMorePhotos/Audemars Piguet/Royal Oak/Royal Oak Blue Dial Steel Smooth Bezel
AP-008,Audemars Piguet,Royal Oak,Royal Oak Frosted Rose Gold Pink Dial,Pink,Rose Gold,Frosted Rose Gold Octagonal,Bracelet,Rose Gold,Women,33,1,need_photos,NeedMorePhotos/Audemars Piguet/Royal Oak/Royal Oak Frosted Rose Gold Pink Dial
AP-009,Audemars Piguet,Royal Oak,Royal Oak Frosted White Gold Silver Dial,Silver,White Gold,Frosted White Gold Octagonal,Bracelet,White Gold,Women,33,1,need_photos,NeedMorePhotos/Audemars Piguet/Royal Oak/Royal Oak Frosted White Gold Silver Dial
AP-010,Audemars Piguet,Royal Oak,Royal Oak Frosted Yellow Gold Champagne Dial,Gold,Yellow Gold,Frosted Yellow Gold Octagonal,Bracelet,Yellow Gold,Women,33,1,need_photos,NeedMorePhotos/Audemars Piguet/Royal Oak/Royal Oak Frosted Yellow Gold Champagne Dial
AP-011,Audemars Piguet,Royal Oak,Royal Oak Green Dial Yellow Gold Bracelet,Green,Yellow Gold,Octagonal,Bracelet,Yellow Gold,Men,41,2,need_photos,NeedMorePhotos/Audemars Piguet/Royal Oak/Royal Oak Green Dial Yellow Gold Bracelet
AP-012,Audemars Piguet,Royal Oak,Royal Oak White Dial Steel Diamond Bezel,White,Stainless Steel,Diamond Set,Bracelet,Stainless Steel,Women,33,1,need_photos,NeedMorePhotos/Audemars Piguet/Royal Oak/Royal Oak White Dial Steel Diamond Bezel
BRT-001,Breitling,Navitimer,Navitimer B01 Chronograph Black Dial Steel Bracelet,Black,Stainless Steel,Bidirectional Slide Rule,Bracelet,Stainless Steel,Men,43,2,need_photos,NeedMorePhotos/Breitling/Navitimer/Navitimer B01 Chronograph Black Dial Steel Bracelet
BRT-002,Breitling,Navitimer,Navitimer Chronograph Purple Dial Steel Slide Rule Bezel,Purple,Stainless Steel,Slide Rule,Bracelet,Stainless Steel,Men,43,1,need_photos,NeedMorePhotos/Breitling/Navitimer/Navitimer Chronograph Purple Dial Steel Slide Rule Bezel
CAR-001,Cartier,Ballon Bleu,Ballon Bleu Steel Silver Dial Steel Bracelet,Silver,Stainless Steel,Smooth,Bracelet,Stainless Steel,Women,33,1,need_photos,NeedMorePhotos/Cartier/Ballon Bleu/Ballon Bleu Steel Silver Dial Steel Bracelet
CAR-002,Cartier,Panthere,Panthere Medium White Dial Steel Diamond Bezel Bracelet,White,Stainless Steel,Diamond,Bracelet,Stainless Steel,Women,27,1,need_photos,NeedMorePhotos/Cartier/Panthere/Panthere Medium White Dial Steel Diamond Bezel Bracelet
CAR-003,Cartier,Panthere,Panthere Medium White Dial Yellow Gold Bracelet,White,Yellow Gold,Smooth,Bracelet,Yellow Gold,Women,27,1,need_photos,NeedMorePhotos/Cartier/Panthere/Panthere Medium White Dial Yellow Gold Bracelet
CAR-004,Cartier,Panthere,Panthere Small White Dial Steel Bracelet,White,Stainless Steel,Smooth,Bracelet,Stainless Steel,Women,22,2,need_photos,NeedMorePhotos/Cartier/Panthere/Panthere Small White Dial Steel Bracelet
CAR-005,Cartier,Panthere,Panthere Small White Dial Steel Diamond Bezel Bracelet,White,Stainless Steel,Diamond,Bracelet,Stainless Steel,Women,22,1,need_photos,NeedMorePhotos/Cartier/Panthere/Panthere Small White Dial Steel Diamond Bezel Bracelet
CAR-006,Cartier,Panthere,Panthere Small White Dial Two Tone Diamond Bezel Bracelet,White,Steel And Rose Gold,Diamond,Bracelet,Steel And Rose Gold,Women,22,1,need_photos,NeedMorePhotos/Cartier/Panthere/Panthere Small White Dial Two Tone Diamond Bezel Bracelet
CAR-007,Cartier,Panthere,Panthere White Dial Two Tone Steel And Gold Bracelet,White,Steel And Yellow Gold,Smooth Yellow Gold,Bracelet,Steel And Yellow Gold,Women,22,1,need_photos,NeedMorePhotos/Cartier/Panthere/Panthere White Dial Two Tone Steel And Gold Bracelet
CAR-008,Cartier,Panthere,Panthere White Dial Two Tone Steel And Rose Gold Diamond Bezel Bracelet,White,Steel And Rose Gold,Diamond Set,Bracelet,Steel And Rose Gold,Women,22,1,need_photos,NeedMorePhotos/Cartier/Panthere/Panthere White Dial Two Tone Steel And Rose Gold Diamond Bezel Bracelet
CAR-009,Cartier,Panthere,Panthere White Dial Yellow Gold Diamond Bezel Bracelet,White,Yellow Gold,Diamond Set,Bracelet,Yellow Gold,Women,22,1,need_photos,NeedMorePhotos/Cartier/Panthere/Panthere White Dial Yellow Gold Diamond Bezel Bracelet
CAR-010,Cartier,Santos,Santos Black Dial Steel Bracelet,Black,Stainless Steel,Black Bezel With Screws,Bracelet,Stainless Steel,Men,40,1,need_photos,NeedMorePhotos/Cartier/Santos/Santos Black Dial Steel Bracelet
CAR-011,Cartier,Santos,Santos Green Dial Yellow Gold Green Leather Strap,Green,Yellow Gold,Green Stepped,Strap,Leather,Men,40,1,need_photos,NeedMorePhotos/Cartier/Santos/Santos Green Dial Yellow Gold Green Leather Strap
CAR-012,Cartier,Santos,Santos Purple Dial Steel Bracelet,Purple,Stainless Steel,Steel,Bracelet,Stainless Steel,Men,40,1,need_photos,NeedMorePhotos/Cartier/Santos/Santos Purple Dial Steel Bracelet
